<?xml version="1.0" encoding="UTF-8"?>
<xs:schema xmlns:xs="http://www.w3.org/2001/XMLSchema">

	<!-- Model root element -->
	<xs:element name="model">
		<xs:complexType>
			<xs:sequence>
				<xs:element ref="name" />
				<xs:element ref="description" minOccurs="0" />
				<xs:element ref="version" minOccurs="0" />
				<!-- Define model types -->
				<xs:element name="type">
					<xs:simpleType>
						<xs:restriction base="xs:string">
							<xs:enumeration value="COLLECTION" />
							<xs:enumeration value="DATA" />
							<xs:enumeration value="DATASET" />
							<xs:enumeration value="DOCUMENT" />
						</xs:restriction>
					</xs:simpleType>
				</xs:element>
				<xs:element ref="attribute" minOccurs="0" maxOccurs="unbounded" />
				<xs:element ref="fragment" minOccurs="0" maxOccurs="unbounded" />
			</xs:sequence>
		</xs:complexType>
	</xs:element>

	<!-- Fragment root element -->
	<xs:element name="fragment">
		<xs:complexType>
			<xs:sequence>
				<xs:element ref="name" />
				<xs:element ref="description" minOccurs="0" />
				<xs:element ref="version" minOccurs="0" />
				<xs:element ref="attribute" minOccurs="0" maxOccurs="unbounded" />
			</xs:sequence>
			<xs:attribute name="ref" type="xs:string"/>
		</xs:complexType>
	</xs:element>

	<!-- Define name -->
	<xs:element name="name">
		<xs:simpleType>
			<xs:restriction base="xs:token">
				<xs:pattern value="[0-9a-zA-Z_]{3,32}" />
			</xs:restriction>
		</xs:simpleType>
	</xs:element>

	<!-- Define description -->
	<xs:element name="description">
		<xs:simpleType>
			<xs:restriction base="xs:string">
				<xs:whiteSpace value="preserve" />
			</xs:restriction>
		</xs:simpleType>
	</xs:element>

	<!-- Define description -->
	<xs:element name="version" type="xs:string" />

	<!-- Define attribute -->
	<xs:element name="attribute">
		<xs:complexType>
			<xs:sequence>
				<xs:element ref="name" />
				<xs:element ref="description" minOccurs="0" />
				<xs:element ref="type" />
				<xs:element name="defaultValue" type="xs:string"
					minOccurs="0" />
				<xs:element ref="restriction" minOccurs="0" />
				<!-- For fragment creation, this element is not used and is skipped silently. -->
				<xs:element ref="computationMode" minOccurs="0" />
				<!-- Custom attribute properties -->
				<xs:element ref="property" minOccurs="0" maxOccurs="unbounded" />
			</xs:sequence>
			<xs:attribute name="alterable" type="xs:boolean"
				default="false" />
			<xs:attribute name="optional" type="xs:boolean" default="false" />
			<xs:attribute name="queryable" type="xs:boolean"
				default="false" />
			<xs:attribute name="facetable" type="xs:boolean"
				default="false" />
			<xs:attribute name="group" type="xs:string" />
			<xs:attribute name="ref" type="xs:string"/>
		</xs:complexType>
	</xs:element>

	<!-- Define attribute types -->
	<xs:element name="type">
		<xs:complexType>
			<xs:simpleContent>
				<xs:extension base="restrictionType">
					<xs:attribute name="unit" type="xs:string" default="unitless" />
					<xs:attribute name="precision" type="xs:integer" />
					<xs:attribute name="arraysize" type="xs:integer"></xs:attribute>
				</xs:extension>
			</xs:simpleContent>
		</xs:complexType>
	</xs:element>


	<!-- All types -->
	<xs:simpleType name="restrictionType">
		<xs:restriction base="xs:string">
			<xs:enumeration value="BOOLEAN" />
			<xs:enumeration value="DATE_ARRAY" />
			<xs:enumeration value="DATE_INTERVAL" />
			<xs:enumeration value="DATE_ISO8601" />
			<xs:enumeration value="ENUMERATION" />
			<xs:enumeration value="DOUBLE" />
			<xs:enumeration value="DOUBLE_ARRAY" />
			<xs:enumeration value="DOUBLE_INTERVAL" />
			<xs:enumeration value="GEOMETRY" />
			<xs:enumeration value="INTEGER" />
			<xs:enumeration value="INTEGER_ARRAY" />
			<xs:enumeration value="INTEGER_INTERVAL" />
			<xs:enumeration value="STRING" />
			<xs:enumeration value="STRING_ARRAY" />
			<xs:enumeration value="URL" />
		</xs:restriction>
	</xs:simpleType>

	<!-- Enumeration restriction -->
	<xs:element name="enumeration">
		<xs:complexType>
			<xs:sequence>
				<xs:element name="value" type="xs:string" maxOccurs="unbounded" />
			</xs:sequence>
		</xs:complexType>
	</xs:element>

	<!-- Pattern restriction -->
	<xs:element name="pattern">
		<xs:simpleType>
			<xs:restriction base="xs:string">
				<xs:whiteSpace value="preserve" />
				<xs:minLength value="1" />
			</xs:restriction>
		</xs:simpleType>
	</xs:element>

	<!-- Integer range restriction -->
	<xs:element name="integer_range">
		<xs:complexType>
			<xs:sequence>
				<xs:element name="min">
					<xs:complexType>
						<xs:simpleContent>
							<xs:extension base="xs:integer">
								<xs:attribute name="excluded" type="xs:boolean"
									default="false" />
							</xs:extension>
						</xs:simpleContent>
					</xs:complexType>
				</xs:element>
				<xs:element name="max">
					<xs:complexType>
						<xs:simpleContent>
							<xs:extension base="xs:integer">
								<xs:attribute name="excluded" type="xs:boolean"
									default="false" />
							</xs:extension>
						</xs:simpleContent>
					</xs:complexType>
				</xs:element>
			</xs:sequence>
		</xs:complexType>
	</xs:element>

	<!-- Double range restriction -->
	<xs:element name="double_range">
		<xs:complexType>
			<xs:sequence>
				<xs:element name="min">
					<xs:complexType>
						<xs:simpleContent>
							<xs:extension base="xs:double">
								<xs:attribute name="excluded" type="xs:boolean"
									default="false" />
							</xs:extension>
						</xs:simpleContent>
					</xs:complexType>
				</xs:element>
				<xs:element name="max">
					<xs:complexType>
						<xs:simpleContent>
							<xs:extension base="xs:double">
								<xs:attribute name="excluded" type="xs:boolean"
									default="false" />
							</xs:extension>
						</xs:simpleContent>
					</xs:complexType>
				</xs:element>
			</xs:sequence>
		</xs:complexType>
	</xs:element>

	<!-- Define restriction -->
	<xs:element name="restriction">
		<xs:complexType>
			<xs:choice>
				<xs:element ref="enumeration" />
				<xs:element ref="pattern" />
				<xs:element ref="integer_range" />
				<xs:element ref="double_range" />
			</xs:choice>
		</xs:complexType>
	</xs:element>

	<!-- Define computation modes -->
	<xs:element name="computationMode" default="GIVEN">
		<xs:simpleType>
			<xs:restriction base="xs:string">
				<xs:enumeration value="GIVEN" />
				<xs:enumeration value="FROM_DESCENDANTS" />
				<xs:enumeration value="CUSTOM" />
			</xs:restriction>
		</xs:simpleType>
	</xs:element>

	<!-- Custom attribute properties -->
	<xs:element name="property">
		<xs:complexType>
			<xs:attribute name="key" type="xs:string" use="required" />
			<xs:attribute name="value" type="xs:string" use="required" />
		</xs:complexType>
	</xs:element>

</xs:schema>