<?xml version="1.0" encoding="UTF-8"?>
<model xmlns:xsi="http://www.w3.org/2001/XMLSchema-instance"
	xsi:noNamespaceSchemaLocation="../../../../../models/models-domain/src/main/resources/model_V1.0.xsd">
	<name>MISSION</name>
	<description>Sample mission</description>
	<type>COLLECTION</type>
	<attribute>
		<label>forTests</label>
		<name>reference</name>
		<type>STRING</type>
	</attribute>
</model>