<?xml version="1.0" encoding="UTF-8"?>
<model xmlns:xsi="http://www.w3.org/2001/XMLSchema-instance"
       xsi:noNamespaceSchemaLocation="../../../../../../../models/models-domain/src/main/resources/model_V1.0.xsd">
    <name>VALIDATION_DATA_MODEL_2</name>
    <description>validation data model with geometries</description>
    <version>1</version>
    <type>DATA</type>
    <attribute>
        <label>pays</label>
        <name>country</name>
        <type>STRING</type>
    </attribute>
    <attribute>
        <label>superficie</label>
        <name>area</name>
        <type>DOUBLE</type>
    </attribute>
</model>